date,username,to,replies,retweets,favorites,text,geo,mentions,hashtags,id,permalink
2020-01-21 06:16:56,XHNews,,3,12,36,"#DailyChinaBriefing on Jan. 21: 1 China takes top-level preventive, control measures against 2019-nCoV pneumonia http://xhne.ws/8y98q 2 Chinese envoy at Berlin conference on Libya issue http://xhne.ws/QyrQI 3 China's space station core module http://xhne.ws/BmUvJ",,,#DailyChinaBriefing,1219504131049754630,https://twitter.com/XHNews/status/1219504131049754630
2020-01-21 03:13:33,XHNews,,8,18,45,"China takes top-level preventive, control measures against 2019-nCoV pneumonia http://xhne.ws/8y98q",,,,1219457981974241280,https://twitter.com/XHNews/status/1219457981974241280
2020-01-20 14:08:18,XHNews,,13,26,43,"President Xi Jinping has ordered resolute efforts to curb the spread of the novel coronavirus (2019-nCoV) that caused cases of pneumonia as a total of 224 cases had been reported in China by 6 p.m. Monday http://xhne.ws/ECAV0",,,,1219260365483184129,https://twitter.com/XHNews/status/1219260365483184129
2020-01-20 10:43:00,TIME,,40,700,717,"The Wuhan pneumonia crisis highlights the danger in China's opaque way of doing things ",,,,1219208698695966721,https://twitter.com/TIME/status/1219208698695966721
2020-01-20 03:44:33,XHNews,,2,4,27,"#DailyChinaBriefing on Jan. 20 1. Beijing, Guangdong reports pneumonia cases, Wuhan confirms 3rd death http://xhne.ws/sHsb3 2. Elderly Chinese man mind-controls robotic arm http://xhne.ws/GRMLq 3. Flying squirrels &amp; villagers in NW China http://xhne.ws/jIGzN",,,#DailyChinaBriefing,1219103394687848449,https://twitter.com/XHNews/status/1219103394687848449
2020-01-20 01:05:59,Reuters,,7,81,80,"China confirms 139 new cases of pneumonia over weekend, virus spreads to new cities https://reut.rs/37cyUx1",,,,1219063487663673350,https://twitter.com/Reuters/status/1219063487663673350
2020-01-19 14:49:47,TIME,,5,95,136,"17 more people diagnosed with deadly viral pneumonia in China ",,,,1218908418381099008,https://twitter.com/TIME/status/1218908418381099008
2020-01-19 12:00:30,XHNews,,0,30,38,"China's Wuhan reported 17 new coronavirus-related pneumonia cases Friday ",,,,1218865815157706752,https://twitter.com/XHNews/status/1218865815157706752
2020-01-19 11:30:07,WSJ,,9,63,72,"Seventeen new cases of the pneumonia-like coronavirus have been identified in China, raising concerns the disease could spread as hundreds of millions of people travel for the Lunar New Year holiday ",,,,1218858169125961729,https://twitter.com/WSJ/status/1218858169125961729
2020-01-19 07:20:00,RT_com,,18,167,149,"New deadly pneumonia-like virus has already spread from #China to #Japan &amp; #Thailand",,,#China #Japan #Thailand,1218795224169840640,https://twitter.com/RT_com/status/1218795224169840640
2020-01-18 15:10:00,TIME,,3,76,99,"China reports 4 more cases in viral pneumonia outbreak ",,,,1218551115647803392,https://twitter.com/TIME/status/1218551115647803392
2020-01-18 12:11:15,SkyNews,,12,24,33,"Two people in Wuhan, China have died after an outbreak of pneumonia linked to a new strain of coronavirus which is believed to have started in a seafood market ",,,,1218506134727921664,https://twitter.com/SkyNews/status/1218506134727921664
2020-01-17 19:45:03,WSJ,,5,35,71,"People traveling to the U.S. from Wuhan, China, will be screened for fevers, coughs or difficulty breathing, after a new pneumonia-like virus sickened dozens in Asia ",,,,1218257948067160067,https://twitter.com/WSJ/status/1218257948067160067
2020-01-16 10:00:00,Reuters,,9,75,64,"A Japanese man has tested positive for the new China coronavirus. The patient had returned this month from Wuhan, the Chinese city where there has been an outbreak of pneumonia believed to be caused by the new strain https://reut.rs/2FVSgue",,,,1217748326776373249,https://twitter.com/Reuters/status/1217748326776373249
2020-01-11 11:57:22,XHNews,,3,21,36,"One patient has died of coronavirus-related pneumonia in Wuhan, China ",,,,1215965922365755396,https://twitter.com/XHNews/status/1215965922365755396
2020-01-11 09:00:13,WSJ,,13,89,86,"The virus implicated in a mysterious outbreak of pneumonia in central China is in a class of pathogens that are a growing player in global infectious disease epidemics ",,,,1215921342761119745,https://twitter.com/WSJ/status/1215921342761119745
2020-01-11 03:42:28,RT_com,,3,63,52,"Lethal SARS-linked coronavirus claims first life as China’s pneumonia outbreak infects dozens ",,,,1215841379013857280,https://twitter.com/RT_com/status/1215841379013857280
2020-01-09 18:07:01,Reuters,,9,61,69,"WHO says new virus may have caused China pneumonia outbreak https://reut.rs/2QF7V7i",,,,1215334175072489472,https://twitter.com/Reuters/status/1215334175072489472
2020-01-09 15:05:43,washingtonpost,,8,43,70,"China identifies new strain of coronavirus as source of pneumonia outbreak ",,,,1215288547982352391,https://twitter.com/washingtonpost/status/1215288547982352391
2020-01-09 08:07:09,washingtonpost,,9,45,70,"China identifies new strain of coronavirus as source of pneumonia outbreak https://wapo.st/2sYHlNu",,,,1215183214110806016,https://twitter.com/washingtonpost/status/1215183214110806016
2020-01-06 11:45:05,WSJ,,3,59,59,"Health officials investigate a mystery viral pneumonia that has infected 59 in central China, and triggered health alerts in Hong Kong and Singapore ",,,,1214150895086264320,https://twitter.com/WSJ/status/1214150895086264320
